{
  "id": "bacf1110-eff7-4a5c-8aa3-3468397bdf77",
  "paper_id": "76a5681f-7501-45fc-9154-6c65dc22772d",
  "author_id": "local",
  "number": 1,
  "type": "multiple_choice",
  "marks": 1,
  "stimulus": [
    {
      "kind": "text",
      "text": "The probability distribution table for a discrete random variable X is shown."
    },
    {
      "kind": "table",
      "html": "<table><thead><tr><th>$x$</th><th>$P(X = x)$</th></tr></thead><tbody><tr><td>1</td><td>0.4</td></tr><tr><td>2</td><td>0.2</td></tr><tr><td>3</td><td></td></tr></tbody></table>"
    }
  ],
  "content": [
    {
      "kind": "text",
      "text": "What is the value of $P(X = 3)$?"
    }
  ],
  "options": [
    {
      "label": "A",
      "content": [
        {
          "kind": "text",
          "text": "0.2"
        }
      ]
    },
    {
      "label": "B",
      "content": [
        {
          "kind": "text",
          "text": "0.4"
        }
      ]
    },
    {
      "label": "C",
      "content": [
        {
          "kind": "text",
          "text": "1.2"
        }
      ]
    },
    {
      "label": "D",
      "content": [
        {
          "kind": "text",
          "text": "2.0"
        }
      ]
    }
  ],
  "topics": [
    "probability"
  ],
  "created_at": "2026-06-02T10:58:26.652Z",
  "updated_at": "2026-06-02T11:55:41.929Z",
  "answer": "B"
}